5062,CR,2,San José,San José,,,,"The Capital. National Theatre. Gold Museum."
5064,CR,4,Alajuela,Alajuela,,,,"Juan Santamaría Airport. Poás Volcano nearby."
5065,CR,5,Guanacaste,Liberia,,,,"Gateway to Pacific beaches. 'The White City'."
5066,CR,6,Puntarenas,Puntarenas,,,,"Pacific port city. Ferries to Nicoya Peninsula."
5067,CR,7,Limón,Limón,,,,"Caribbean coast. Afro-Caribbean culture. Tortuguero access."
5068,CR,8,Cartago,Cartago,,,,"Old Capital. Basilica of Our Lady of the Angels."
5069,CR,9,Heredia,Heredia,,,,"'City of Flowers'. Coffee plantations."
5068,CR,8,Costa Rica,Mobile,,,,"Mobile services (Kölbi / Liberty / Claro)"

